{"$schema":"https://momi.local/schemas/legacy-access-governance-report-v1.schema.json","artifact_kind":"legacy_access_governance_report","findings":[{"access_mode":"write","consumer_service":"toast-data-acquisition","fingerprint":"sha256:023d46fea0f117b4569efd941670b013630011cfaf1d79ebd1642d0ad7a789e4","object":{"identity":"toast_raw.webhook_events","kind":"relation"},"owner_service":"communications-archive","reference_count":"1","rule_id":"direct_private_relation_access","rule_version":1,"sql_source_hash":"sha256:3f1e2f48a6391bd81d7de3c13ddfe0ab9e806a1de7e0c9f75e97250ae4666f7b","subject":"database/routines/toast_acquisition.sync_ordering_schedule_raw_row--6e01238397b1.sql"},{"access_mode":"read","consumer_service":"order-alerting","fingerprint":"sha256:052915818a4f68b83c52d8f1e798735268f661ecbc36a1c40d62776d089b1b96","object":{"identity":"momi_alerting.slack_destinations","kind":"relation"},"owner_service":"slack-order-delivery","reference_count":"1","rule_id":"direct_private_relation_access","rule_version":1,"sql_source_hash":"sha256:2c54df86dae11fdb6c6d8d76b1adbfa8eb81697ad8535c22c6bd3014dfab10dc","subject":"database/routines/momi_alerting.claim_order_alert_candidates--587006cb780e.sql"},{"access_mode":"read","consumer_service":"toast-data-acquisition","fingerprint":"sha256:05eaa335793803fa60f0f6350d74d0018a1a258cce3747bcd1bcfbbde15c7dc0","object":{"identity":"toast_raw.api_request_attempts","kind":"relation"},"owner_service":"communications-archive","reference_count":"1","rule_id":"direct_private_relation_access","rule_version":1,"sql_source_hash":"sha256:7d2753b009b64e49a6a987371c2326cf946336e74a976531f72e6deb869e4aec","subject":"services/toast-data-acquisition/functions/toast-data-acquisition-v1/src/record_failure_coverage.ts"},{"access_mode":"read","consumer_service":"toast-data-acquisition","fingerprint":"sha256:089c9088a6f6f456c506e765f1f73f67c1584d811a17239fb6b00d385df7113d","object":{"identity":"toast_raw.resource_observations","kind":"relation"},"owner_service":"communications-archive","reference_count":"1","rule_id":"direct_private_relation_access","rule_version":1,"sql_source_hash":"sha256:7d2753b009b64e49a6a987371c2326cf946336e74a976531f72e6deb869e4aec","subject":"services/toast-data-acquisition/functions/toast-data-acquisition-v1/src/record_failure_coverage.ts"},{"access_mode":"read","consumer_service":"order-alerting","fingerprint":"sha256:0b68ac92248aebe8add640c5fa4dce633fed17011243c55b408b31efe9c932ff","object":{"identity":"toast_hydration.webhook_order_mappings","kind":"relation"},"owner_service":"toast-order-hydration","reference_count":"1","rule_id":"direct_private_relation_access","rule_version":1,"sql_source_hash":"sha256:f6f5a6f031ed76c9107c6a04ad3526afab73440f87cc449fc41916ba7423421e","subject":"database/routines/momi_orders.enqueue_toast_webhook_order_alert_work--731b77edc311.sql"},{"access_mode":"read","consumer_service":"order-alerting","fingerprint":"sha256:1344202302c63e4f0aee509bfa3bee1037af5292032add4397f137a0288aad8b","object":{"identity":"momi_api.read_view_registry","kind":"relation"},"owner_service":"warehouse-read-api","reference_count":"1","rule_id":"direct_private_relation_access","rule_version":1,"sql_source_hash":"sha256:f6f5a6f031ed76c9107c6a04ad3526afab73440f87cc449fc41916ba7423421e","subject":"database/routines/momi_orders.enqueue_toast_webhook_order_alert_work--731b77edc311.sql"},{"access_mode":"read","consumer_service":"warehouse-projection","fingerprint":"sha256:1537c1aa6250192fc6823d54b09b3738ad8828fccb94a5f74fd9a925c013d5aa","object":{"identity":"toast_raw.webhook_events","kind":"relation"},"owner_service":"communications-archive","reference_count":"1","rule_id":"direct_private_relation_access","rule_version":1,"sql_source_hash":"sha256:b0342dee3e588e3316e1b1eeb1cf2e4c08236abef375f48ddec323cb0e555f18","subject":"database/views/momi_api.toast_order_source_versions_v1.sql"},{"access_mode":"write","consumer_service":"toast-data-acquisition","fingerprint":"sha256:1abd61653b875f377796b66aa2906780390a80c0cadc185232bc181a8c2fe7d3","object":{"identity":"toast_raw.api_request_attempts","kind":"relation"},"owner_service":"communications-archive","reference_count":"1","rule_id":"direct_private_relation_access","rule_version":1,"sql_source_hash":"sha256:e365703f0acee1d68c29bda16e309d0841a22824a87c87f6f4561d7b25ef7414","subject":"services/toast-data-acquisition/functions/toast-data-acquisition-v1/src/fail_attempt_network.ts"},{"access_mode":"write","consumer_service":"toast-order-ingest","fingerprint":"sha256:1b056c01917a5a669c5a24742c9058733f39f1ee4e29c28b575eb14e5b42d8d3","object":{"identity":"toast_raw.order_webhook_events","kind":"relation"},"owner_service":"communications-archive","reference_count":"2","rule_id":"direct_private_relation_access","rule_version":1,"sql_source_hash":"sha256:49a32061bf194e399f79830280e943a0f8b60ca65a185afe213fba2c15b715aa","subject":"services/toast-order-ingest/functions/toast-orders-webhook-ingest-v1/src/store_raw_order_event.ts"},{"access_mode":"write","consumer_service":"toast-data-acquisition","fingerprint":"sha256:1c25514baf77b8881d1b3116caf206b4c00137db5c33074eb378b426c5ff5312","object":{"identity":"toast_raw.resource_versions","kind":"relation"},"owner_service":"communications-archive","reference_count":"1","rule_id":"direct_private_relation_access","rule_version":1,"sql_source_hash":"sha256:ec0a7e857afbf6645f03739b3710fedb1add2f70edc307da0c1a49f22bacfc0d","subject":"database/routines/toast_acquisition.expand_management_group_restaurant--7530d1113f01.sql"},{"access_mode":"write","consumer_service":"order-alerting","fingerprint":"sha256:1f8b4ecca57f3273dadc9659b7d294a496d1eadc9a09fb25849e79c18f26f79b","object":{"identity":"momi_api.read_capabilities","kind":"relation"},"owner_service":"warehouse-read-api","reference_count":"1","rule_id":"direct_private_relation_access","rule_version":1,"sql_source_hash":"sha256:7845e24e40e09de92ae81fec8e77d82f8f94611da8263195ab7bbf1154a3a1d2","subject":"database/routines/momi_alerting.revoke_order_read_capability--fc905c57ecf8.sql"},{"access_mode":"read","consumer_service":"toast-data-acquisition","fingerprint":"sha256:20395e516f8f2fc452eb8ecbd53d7bf6b0c05603d30efa07842d38662167ab82","object":{"identity":"toast_raw.webhook_events","kind":"relation"},"owner_service":"communications-archive","reference_count":"2","rule_id":"direct_private_relation_access","rule_version":1,"sql_source_hash":"sha256:34525f6ed61489e0ac6b704d08e3f18b6dc50a13e26a2c4b277f35aa9fd40e83","subject":"database/routines/toast_acquisition.resync_ordering_schedule_policy--e276600aca01.sql"},{"access_mode":"write","consumer_service":"toast-data-acquisition","fingerprint":"sha256:2c1f5f52024434cb92d1cfe7f484512b67513af5df5510bad2c9aecc6a482d22","object":{"identity":"toast_raw.api_request_attempts","kind":"relation"},"owner_service":"communications-archive","reference_count":"2","rule_id":"direct_private_relation_access","rule_version":1,"sql_source_hash":"sha256:e5e21370e771c289cc073f440a80a0c78208b703040c8af7a6c7826df4a33a20","subject":"database/routines/toast_acquisition.reconcile_stale_api_attempts--b55ef81b3ca4.sql"},{"access_mode":"write","consumer_service":"toast-stock-ingest","fingerprint":"sha256:2c3d43f9b346b47903ca68cd3d7706fd333533b066e717d377924ef0022ac29c","object":{"identity":"toast_raw.stock_webhook_events","kind":"relation"},"owner_service":"communications-archive","reference_count":"2","rule_id":"direct_private_relation_access","rule_version":1,"sql_source_hash":"sha256:08c6b238f91de2f3b8dfbd6c1f087d4146304e21600d3f82ef348aa9e5240bce","subject":"services/toast-stock-ingest/functions/toast-stock-webhook-ingest-v1/src/store_raw_stock_event.ts"},{"access_mode":"read","consumer_service":"toast-data-acquisition","fingerprint":"sha256:30ada220ea96d23cfaac01ac31c5744a9e9ae45b4a2a140cf388a954281aa87f","object":{"identity":"toast_raw.resource_versions","kind":"relation"},"owner_service":"communications-archive","reference_count":"1","rule_id":"direct_private_relation_access","rule_version":1,"sql_source_hash":"sha256:34525f6ed61489e0ac6b704d08e3f18b6dc50a13e26a2c4b277f35aa9fd40e83","subject":"database/routines/toast_acquisition.resync_ordering_schedule_policy--e276600aca01.sql"},{"access_mode":"read","consumer_service":"toast-data-acquisition","fingerprint":"sha256:326274055ebc1033a521c9f1eb547f5c6d883922c709bc2edd061e02a68e9ce8","object":{"identity":"toast_raw.api_request_attempts","kind":"relation"},"owner_service":"communications-archive","reference_count":"3","rule_id":"direct_private_relation_access","rule_version":1,"sql_source_hash":"sha256:6735fc4d92518b75a9667c317da3e76b2e9639210da5215c50f8d4d076b7f37f","subject":"services/toast-data-acquisition/functions/toast-data-acquisition-v1/src/record_coverage.ts"},{"access_mode":"write","consumer_service":"warehouse-projection","fingerprint":"sha256:35edb77729bdad544b8a2b5d7f2b052df32bd5d1db5c0261e90ed2ee2e5c9c09","object":{"identity":"toast_acquisition.jobs","kind":"relation"},"owner_service":"toast-data-acquisition","reference_count":"1","rule_id":"direct_private_relation_access","rule_version":1,"sql_source_hash":"sha256:6482eef0a8fab2f1a79062bc0cbe7319098eae390e202e5469c488e02c65e738","subject":"database/routines/warehouse_projection.project_toast_event--0b780832bdfb.sql"},{"access_mode":"write","consumer_service":"toast-data-acquisition","fingerprint":"sha256:36a87dccf7dbf6ff31d8f16e5db0423cf19b8b1a6a55e5444841241b22a0e0d3","object":{"identity":"toast_raw.resource_versions","kind":"relation"},"owner_service":"communications-archive","reference_count":"2","rule_id":"direct_private_relation_access","rule_version":1,"sql_source_hash":"sha256:84f447143abdb74a1d50dcbd509b0bf6ab2e5b1489441a2fd22c6b7691f3b046","subject":"services/toast-data-acquisition/functions/toast-data-acquisition-v1/src/persist_resources.ts"},{"access_mode":"read","consumer_service":"warehouse-projection","fingerprint":"sha256:3fd529940d6b31ff308dbe63055c1a50d4af3d739cf1fae5a64a1649b9b666d8","object":{"ident